{
  "apiVersion": "clawos/v1",
  "kind": "MCPPanel",
  "metadata": {
    "name": "crm-mcp",
    "title": "CRM Connector",
    "icon": "plug",
    "category": "business",
    "order": 20,
    "tags": ["crm", "production"]
  },
  "spec": {
    "visibility": {
      "enabled": true,
      "environments": ["dev", "staging", "prod"]
    },
    "status": {
      "source": "health_endpoint",
      "endpoint": "/internal/mcp/crm/health",
      "fields": [
        { "key": "status", "label": "运行状态", "type": "badge" },
        { "key": "version", "label": "版本", "type": "text" },
        { "key": "lastHeartbeatAt", "label": "最近心跳", "type": "datetime" }
      ]
    },
    "views": [
      {
        "id": "overview",
        "title": "概览",
        "blocks": [
          { "type": "key_value", "source": "status" },
          {
            "type": "markdown",
            "source": "static",
            "content": "CRM MCP 提供客户查询、线索更新、商机同步能力。"
          }
        ]
      },
      {
        "id": "config",
        "title": "配置",
        "blocks": [
          {
            "type": "form",
            "submitAction": "update_config",
            "fields": [
              {
                "name": "baseUrl",
                "label": "CRM 地址",
                "component": "input",
                "required": true,
                "rules": [{ "type": "url" }]
              },
              {
                "name": "timeoutMs",
                "label": "超时时间(ms)",
                "component": "number",
                "default": 5000,
                "rules": [
                  { "type": "min", "value": 100 },
                  { "type": "max", "value": 30000 }
                ]
              }
            ]
          }
        ]
      },
      {
        "id": "logs",
        "title": "日志",
        "blocks": [
          {
            "type": "table",
            "source": "recent_logs",
            "columns": [
              { "key": "timestamp", "label": "时间" },
              { "key": "level", "label": "级别" },
              { "key": "message", "label": "消息" }
            ]
          }
        ]
      }
    ],
    "actions": [
      { "id": "start", "label": "启动", "type": "lifecycle", "executor": "mcp_runtime.start", "confirm": true },
      { "id": "stop", "label": "停止", "type": "lifecycle", "executor": "mcp_runtime.stop", "confirm": true },
      { "id": "reload", "label": "重载配置", "type": "lifecycle", "executor": "mcp_runtime.reload" },
      {
        "id": "update_config",
        "label": "保存配置",
        "type": "config",
        "executor": "mcp_config.update",
        "payloadSchemaRef": "#/components/schemas/ConfigUpdate"
      },
      { "id": "healthcheck", "label": "健康检查", "type": "observe", "executor": "mcp_observe.healthcheck" }
    ],
    "components": {
      "schemas": {
        "ConfigUpdate": {
          "type": "object",
          "properties": {
            "baseUrl": { "type": "string", "format": "uri" },
            "timeoutMs": { "type": "integer", "minimum": 100, "maximum": 30000 }
          },
          "required": ["baseUrl"]
        }
      }
    }
  }
}
